{
  "request_id": "req_001",
  "message": "The submitted invoice is above the agreed quote. Please respond by Friday.",
  "received_at": "2026-07-13T10:00:00-04:00",
  "reference_timezone": "America/Toronto",
  "documents": [
    {
      "document_id": "quote_001",
      "document_version": "1",
      "text": "Approved service total: CAD 3,200.",
      "content_hash": "sha256:quote-example"
    },
    {
      "document_id": "invoice_001",
      "document_version": "1",
      "text": "Amount due: CAD 4,800.",
      "content_hash": "sha256:invoice-example"
    }
  ],
  "metadata": {
    "source": "email",
    "priority_hint": "high",
    "category_hint": "invoice_dispute"
  }
}
